,tweets,cluster
2164,ngopi nikmat kerja keras perintah joko widodo masyarakat laksana protokol sehat rakyat indonesia cinta vaksin x waspada,21
2165,kasihan anjing ku otak jabat,20
2166,denny siregar maturnuwun khairil anwar notodiputro wassalam,17
2167,fakta rakyat indonesia cinta joko widodo presiden ri rakyat laksana protokol sehat disiplin badai pandemi covid tinggal,21
2168,semayam gubuk miskin megawati soekarnoputri ketua pdi juang renung rakyat indonesia cinta bravo paten,14
2169,lelaki bandung dikatain loba gaya sok nampang buka kartu gatot gagal total laksana protokol sehat disiplin,21
2170,bangga anak pikir dengar anjur bangun laksana protokol sehat disiplin pandemi covid,21
2171,sedang apa urus rumah tangga pdi juang menang rakyat percaya rebut menang hati rakyat indonesia cinta,14
2172,anjing ku repal stres comberan wassalam,20
2173,org tolol kasih komentar wassalam,7
2174,dampak pandemi covid laksana protokol sehat disiplin urus nikah sabar buru,21
2175,dampak pandemi covid laksana protokol sehat disiplin urus nikah sabar,21
2176,tenaga kerja asing masuk indonesia aman investasi lanjur indonesia baris sakit hati kadrun banyak bicara tunjuk mutu kwalitasmu banding mudik lebaran nyambung dungu,15
2177,hibur sambut lebaran mohon af lahir bathin sukses laksana protokol sehat disiplin,21
2178,anjing ku taufik kaing kaing comberan wassalam,4
2179,anjing gonggong comberan mampus wassalam,20
2180,wanita lawan hati lembut salju marah apa laksana protokol sehat presiden ri joko widodo jajar keras pandemi covid,21
2181,joko widodo presiden ri bicara fatal salah uas tzul junjung kerja ngomongngin sara ujar benci fitnah banyak bicara diam dasar baris sakit hati kadrun,15
2182,suami tidak setia bagak sedih laku edaaaaaaan ngeri x tiru laksana protokol sehat disiplin pandemi covid,21
2183,dasar stres cari lemah presiden ri joko widodo cinta rakyat baris sakit hati kadrun bakar jenggot tu menteri dagang lupa puasa marah batal puasa,15
2184,laksana protokol sehat disiplin bersih mandi x x,21
2185,rakyat indonesia cinta disiplin laksana protokol sehat mohon maha kuasa pandemi covid cepat,21
2186,apa wanita jaga rasa berani berduaduaan mobil harap cain gampar dipelototin mata melotot sukses protokol sehat laksana disiplin,21
2187,kang maman chelsea sukses nuhun wassalam,17
2188,chelsea sukses terusssssssss kang maman nuhun wassalam,17
2189,gembira larang hati lihat kiri kanan bawa fokus akibat lalai laksana protokol sehat disiplin paten,21
2190,waspada waspada waspada hati mata jaga indra laksana protokol sehat disiplin paten,0
2191,hati atas langit langit ganggu ganggu rendah hati dukung laksana protokol sehat disiplin badai pandemi covid,21
2192,terima kasih kirim joko widodo periode milu pilih rakyat rakyat presiden ri penuh lemah lembut jujur pimpin indonesia cinta tenang,5
2193,selamat juang patriot sejati tanah papua cinta jaga rakyat laksana protokol sehat disiplin setia tahan nkri ganggu teroris kkb,21
2194,partai milu kalap kader sibuk bela label perintah teroris jakarta papua dukung teroris pilih partai jeroan,3
2195,megawati soekarnoputri percaya ketua dewan arah brin jam terbang ketua pdi juang presiden ri ketua dewan arah bpip pks sewot duduk bonceng,14
2196,anak thr sukses protokol sehat laksana disiplin penerintahan joko widodo jajar keras,21
2197,hibur malam termehek mehek salah do i serah usaha ucap sukses laksana protokok sehat disiplin,19
2198,kkb laku papua buat teroris dialog gelintir teroris kkb rakyat papua cinta damai joko widodo presiden ri rakyat indonesia cinta jokowi maju indonesia maju,10
2199,jenderal tni purn h dr moeldoko kepala staf presiden ri ketua partai demokrat klb deli serdang sukses indonesia maju paten,3
2200,cerah ustadz teladan pasang kucing teladan mana contoh laksana protokol sehat disiplin waspada pandemi covid,21
2201,do sukses terusssssssss bunda tutut soeharto keluarga maturnuwun wassalam,17
2202,jadi lambat sabar tunggu hasil kerja polisi wenang sbg aman dan tertib masyarakat tugas silah tim kuasa hukum langkah hukum tunggu laksana protokol sehat disiplin,18
2203,sakit bicara kakak wassalam,15
2204,sendi rian dukung perintah joko widodo presiden ri laksana protokol sehat disiplin badai virus corona,21
2205,kkb tanah air joko widodo presiden ri kejar tumpas akar akar dukung sikap jokowi presiden cinta rakyat,5
2206,komandan rakyat indonesia bangga korban keringat darah air mata nyawa pahlawan sejati korban indonesia cinta,10
2207,cari sakit dukung perintah cegah pandemi covid laksana protokol sehat disiplin,21
2208,focus group discussion tingkat kesiapsiagaan bencana motto megawati soekarnoputri ketua pdi juang presiden ri wakil presiden ri gerak cepat sasar gerak budaya bencana,14
2209,anwar abbas komentar akal sehat noda mui gaya bicara penuh benci sara mulut harimau kait kapolri jenderal polisi drs listyo sigit prabowo arif bijaksana depan hukum sbg panglima,17
2210,x tampar pipi ku afkan x tampar pipi ku afkan x afkan ditegor sutradara ulang ulang adegan tampar laksana protokol sehat disiplin,17
2211,selamat hati ulang kartini ingat anak pahlawan nasional jasa indonesia cinta lupa ingat keluarga tetangga lingkung warga masyarakat disiplin laksana protokol sehat,21
2212,lucu sok ngomongngin reshuffle menteri bantu prsiden baris sakit hati kadrun masuk nominasi ganti tokoh senang musuh politik termehek mehek,19
2213,rocky menggrung grung stres presiden ri negara iriana joko widodo hina kritisi joko widodo rasa rakyat indonesia cinta g a c a rocky gerung,5
2214,sorga bawah telapak kaki cinta ustadz lupa lahir keringat darah nyawa taruh besar anak sukses laksana protokol sehat disiplin,21
2215,kapolda metro jaya arah komandan sejuk hati wujud rakyat indonesia cinta warga negara kelas pakai jalan sukses protokol sehat laksana disiplin,21
2216,nenek kreatif cucu pening ajak be canda disiplin protokol sehat,21
2217,nama jago sukses protokol sehat dukung g laksana perintah joko widodo presiden ri paten,21
2218,waspada waspada waspada pandu perhati paten laksana protokol sehat disiplin lupa,0
2219,anak pintar ngakali dewasa dukung cegah pandemi covid laksana protokol sehat disiplin lupa paten,21
2220,terima kasih tanggal april vaksin teman istri ku ana anak ku sarah jalan berkat kasih sayang ku kristus,3
2221,hibur laksana protokol sehat disiplin,21
2222,serba serbi suasana pandemi covid rakyat indonesia cinta kreatif dukung perintah joko widodo presiden ri protokol sehat laksana disiplin paten,21
2223,daily lifeku dicheck instagram jogging pagi jam jaga sehat produktif,17
2224,kenal pribadi ku ekspos follow instagramku see you on instagram,17
2225,buat hasil fokus laksana protokol sehat disiplin badai covid,21
2226,anjing stres comberan wassalam,20
2227,jalan takut gusti mboten sare laksana disiplin protokol sehat paten,21
2228,bodoh aneh super hebat presiden ri joko widodo jabat turun rakyat cinta mantap paten,5
2229,mulut harimau alami hormat adil benteng adil dakwa jaksa benar hormat apa putus laksana majelis hakim mulia paten,17
2230,belanda milu pilpres gubernur bupati walikota dpr dpd dprd tk sibuk panas sabar stres sukses protokol sehat badai covid,17
2231,tolol sok pintar kakak wassalam,7
2232,nikmat bahagia sedang apa dipikirin stres imun tubuh drop dukung perintah joko widodo presiden ri keras disiplin laksana protokol sehat,21
2233,kaing kaing comberan lucu x cain,4
2234,kader partai demokrat besar besar bangga peran ketua hasil klb sibolangit jenderal tni purn dr h moeldoko perhati partipasinya bencana alam ntt ntb,3
2235,tokoh tokoh toko besi toko sembilan bahan pokok toko embeeeeeeer dukung perintah joko widodo presiden ri jajar berkat do a rakyat indonesia cinta aku dunia sukses covid protokol sehat,5
2236,cam baik laksana protokol sehat disiplin songsong indonesia maju,21
2237,setneg unggah foto nikah atta aurel salah joko widodo presiden ri lekat jabat jokowi negara iriana atur protokol an mohon maklum,5
2238,dogol banding pete jengkol kadrun wassalam,17
2239,apa agama percaya yakin terussssssslah serah maha mohon pandemi covid disiplin laksana protokol sehat,21
2240,megawati soekarnoputri ketua pdi juang politis negarawan senior presiden ri teladan rasa pahit getir juang penting rakyat indonesia cinta terusssss ukir dada hati,14
2241,rangkai ajar gabenar kadrun repot wassalam,17
2242,banding rezim jokowi soeharto top tua ompong peot as monas jokja ngeri kakak kakak sakit masuk rs jiwa grogol,17
2243,joko widodo presiden ri keluar perppu terrorisme anti laku kecut terroris dukung dengar baris sakit hati kadrun dalang lindung teroris bakar jenggot paten,15
2244,maju indonesia maju laksana protokol sehat disiplin badai pandemi covid,21
2245,akibat salah gaul lupa laksana protokol sehat disiplin paten,21
2246,terima kasih polisi buka laku malu lelaki mata keranjang rasain polisi lintas akal kena batu dukung perintah joko widodo presiden ri laksana protokol sehat disiplin,21
2247,indah demokrasi negara indonesia cinta ikut menang kalah langgar percaya partai laksana tinggal rakyat era reformasi cerdas paten,10
2248,renung arti dukung perintah joko widodo presiden ri kader pdi juang ketua megawati soekarnoputri presiden ri laksana protokol sehat disiplin paten,14
2249,tukang tipu lawan tipu a r a paten,17
2250,hibur stres laksana protokol sehat disiplin terima kasih tni polri jajar bin bnpt kerja keras ungkap peristiwa bom gereja katedral makasar terang benderang,21
2251,jenderal tni purn dr moeldoko ketua partai demokrat klb sibolangit,3
2252,teroris agama otak rusak ajar agama salah mohon salah agama b o h o g teroris agama dukung perintah tni polisi bin jajar ungkap bom gereja katedral makasar paten,17
2253,jenderal tni dr moeldoko ketua partai demokrat klb sibolangit paten,3
2254,rakyat indonesia cinta sabar tunggu hasil kerja keras kapolri jajar bin ungkap terang benderang peristiwa bom bunuh gereja katedral makasar selamat berkat,10
2255,kader bangga kader sejati berani sikap klb sibolangit moeldoko aklamasi ketua partai demokrat angka nilai maturnuwun jenderal tni dr moeldoko selamat,3
2256,dunia dua sain kena batu anak kost bumi bantu perintah joko widodo presiden ri atas pandemi covid laksana protokol sehat disiplin,21
2257,megawati soekarnoputri lengser keprabon hati kader simpatisan rakyat pilih setia pdi juang terima kharisma korban ibunda partai pahit manis juang alami,14
2258,kalap rasa partai gembos besan diri partai demokrasi c l a s tepuk air dulang terpercik muka malu ketua mpr ri c l a s politik turun kelas wakil,3
2259,sebentar hitung jam maju juang jadi rumah politik rakyat teduh gerah benah kibar panji pelosok tanah air indonesia cinta paten,10
2260,jendral tni purn moeldoko anjing gonggong kafilah maju kibar panji partau demokrat ketua klb sibolangit sekretaris jenderal jhonny allen marbun,3
2261,partai politik oknum kader libat korupsi tahan kpk mulut otak kutil ngebacotnya pdi juang korupsi dasar kadrun,14
2262,berdo a mohon maha kuasa tolong umat covid laksana protokol sehat disiplin,21
2263,baris sakit hati kadrun malu dengar nyata sehat wni hati nilai joko widodo presiden indonesia cinta objektif malu dengar ayo sukses protokol sehat,15
2264,jam terbang alam tokoh bakar jenggot geradak geruduk cacing panas diri duduk rendah hasil menteri hukum ham ach gelap,17
2265,anjing stres comberan mampus wassalam,20
2266,karenac sadar jalan wassalam,17
2267,laksana pesan joko widodo presiden ri kerja kerja kerja percaya rakyat indonesia cinta s s e s laku sara fitnah ujar benci teror baris sakit hati kadrun dukung protokol sehat badai covid,6
2268,anjing stresssssssss comberan mampus wassalam,20
2269,anjing gonggong comberan mampus wassalam,20
2270,hebat ikut setia seberang percaya,17
2271,sekjen pdi juang hasto kristiyanto bijak import beras sarat penting buru rente hasto basis kuat utama perintah rakyat buru rente rente,17
2272,ngaca ngebacot masuk omberan wassalam,17
2273,stresssssssss silah puas i fitnah bohong ujar benci teror gusti mboten sare super star lawan,9
2274,ngelawak ngelawak hati lho marah sono laksana protokol sehat disiplin,21
2275,ganti majikan tolol dukung pilih rakyat presiden baris sakit hati kadrun,15
2276,baris sakit hati kadrun joko widodo presiden ri kerja keras layan rakyat kasih wajar izin rubah uu periode capreskan pilih milu presiden jokowi tunduk atur,5
2277,suka ngebelah bicara belah kakak lupa ucap lidah tulang ayo ngebacot wassalam,17
2278,penjara dukung ngebacot hasil putus rugi sabar duduk bonceng wassalam,23
2279,nama ormasnya hebat ngoceh kadrun,17
2280,sby dipodcast tepuk air dulang terpercik muka kader demokrat tum ahy bau kencur suka fitnah bunuh karakter berita bohong tipu muslihat lahir klb sibolangit tum moeldoko sekjen jam,17
2281,anak takut kejar bayang wajar manula ar takut kejar bayang akibat lihat curigaaaaaa lucu wacana jabat presiden periode sukses protokol sehat disiplin,17
2282,coba hambat joko widodo presiden ri kunjung kerja sulawesi selatan laut baris sakit hati kadrun coba lawan nasionalis sejati rakyat indonesia cinta indonesia maju,15
2283,gugat cerai umbar umbar media teladan sedih wassalam,17
2284,gabenar pilih sara ujar benci fitnah teror b o h o g janji kampanye bohong telanjang satu korban rakyat pilih,9
2285,presiden ri joko widodo seng lawan rakyat periode presiden baris sakit hati kadrun kalap stres curigaaaaaaa panjang jokowi tolak,15
2286,anjing ku ali r stressssssss comberan,20
2287,terima kasih selesai vaksin jalan sukses maturnuwun joko widodo presiden indonesia megawati soekarnoputri presiden ri ketua pdi juang,14
2288,filosofi budaya jawa renung rakyat indonesia cinta sekjen pdi juang hasto prinsip satyam eva jayate arti benar menang kalap fitnah partai politik pecah kongsi,14
2289,anjing stresssssssss comberan mampus,20
2290,manusia penuh curiga dengar nyata presiden ri joko widodo kait jabat presiden periode curiga cari panggung malu ajak rakyat laksana protokol sehat,5
2291,saran partai lanjut laut wassalam,3
2292,tolol sok pintar patuh atur latih bicara gagap kakak wassalam,7
2293,erti politik sok bicara politik kakak diam duduk bonceng sok pintar tolol,23
2294,tolak wacana jabat presiden periode partai politik pks kalah perang kerja rakyat ribut w a c a a c r i g a depan demokrasi apa hormat,1
2295,dangkal wawas politik kelompok ahy jasa hukum bawa kerja nyata cinta kiri kanan fokus bela beri kuasa gatot gagal total ketua hasil klb sibolangit moeldoko syah yasona menteri hukum ham,18
2296,muka badak terima jabat komut bumn kerja pecat marah baris sakit hati kadrun ge,15
2297,refly harun baris sakit hati stres x komut bumn pecat nyinyirin ketua pdi juang megawati soekarnoputri libat kudeta amat tong kosong bunyi hati sebentar masuk rs jiwa grogol,15
2298,luhut anies mesra cepat anies patuh laksana nasehat arah luhut binsar pandjaitan urus dki lbp profesional paten percaya joko widodo presiden ri,11
2299,fakta anies luhut binsar pandjaitan urus banjir hari rakyat,11
2300,followersnya ribu kakak wassalam,17
2301,potong lihat pandang wanita lihat kaki ujung rambut klb sibolangit komentar sukses protokol sehat disiplin,21
2302,tolol kagum makan siang kakak wassalam,7
2303,mami ku cinta umur jelang jam vaksin terima kasih berkat kasih sayang jalan sukses,3
2304,sebar hoaxs benar lupa sby hubung cegah saudara laki benny kabur harman bezoek baasir markas besar polri gagal intervensi presiden ri sby,17
2305,kadrun kena batu sikaaaaaaat,17
2306,hubung anjing jaga partai demokrat partai buka moderen nasionalis relegius dinasty ketua moeldoko demisioner,3
2307,art pakar hukum lihat potong objektif nilai af tonton sok pintar asal bunyi,18
2308,erti masalah partai demokrat tutup mulut sok pintar coba suruh presiden ri jokowi pecat kspnya moeldoko karma bicara kader jaya anjing jaga,3
2309,ciluk ngacir adik lucu ajak tua laksana protokol sehat disiplin,21
2310,seru malu ach ribut melulu dukung kerja keras perintah joko widodo pandemi covid laksana protokol sehat dg disiplin merdeja,21
2311,politik bukti klb partai demokrat kampung sumatera utara klb fakta tunggu selesai lupa badai covid,3
2312,klb partai demokrat abal abal lucu lucu bakar jenggot gaul kadrun tunggu hasil nyata cinta kanan kiri muka stres,17
2313,teladan megawati soekarnoputri ketua pdi juang alam rasa pahit manis politik indonesia cinta campur rumah tangga partai masalah,14
2314,joko widodo presiden ri sahabat pimpin dunia rendah hati jujur berani cinta rakyat sukses protokol sehat,5
2315,rakyat indonesia cinta joko widodo presiden ri rendah hati basa basi drama maju presiden ri indonesia maju,5
2316,politikus pks saran kebelinger perintah jokowi export ganja lupa partai sorga kakak,17
2317,dukung ajak joko widodo presiden ri produk asing benci mulut bahaya benci cinta waspada waspada waspada,0
2318,nasehat paten negarawan rendah hati joko widodo presiden ri laksana protokol sehat disiplin,21
2319,kreativitas muncul suasana pandemi covid rumah dalang wayang mantul laksana protokol sehat disiplin,21
2320,sejarah partai demokrat silah klik lupa laksana disiplin protokol sehat allen sby diri partai demokrat,3
2321,benny kabur h hati komentar sahabat ku krisyanto yen oni terima rugi sedih badai covid dukung perintah joko widodo protokol protokol sehat,21
2322,anjing ku ar gonggong comberan wassalam,20
2323,supir presiden taxi sayang usaha bubar wassalam,12
2324,anak aduh gemas gaya kalah gadis dewasa arisan laksana protokol sehat disiplin,21
2325,himbauan lelaki teladan kaum wanita rajin sumbang pakai bekas bencana banjir laksana protokol sehat disiplin,21
2326,pdi juang timbo siahaan ruhut poltak sitompul,14
2327,markas besar polri tolak lapor baris sakit hati kadrun lapor sambut rakyat ntt kunjung dinas presiden ri joko widodo kait protokol sehat lapor nyinyir ngebacot benci buta,15
2328,tolak karn lapor beda laksana tugas negara pribadi benci akut,17
2329,rr jabat jilat tendang mencak mencak main silat malu,17
2330,heran sutioso gabenar menang martabat menang sara ujar benci fitnah teror rakyat gusti mboten sare,9
2331,terima kasih jelas kunjung dinas ntt komentar joko widodo presiden ri at hukum sukses protokol sehat disiplin,5
2332,anjing ku gonggong wassalam,20
2333,sama kunjung presiden ri joko widodo ntt pakai kaca mata kuda beda nyinyir ngebacot buang energi tong kosong nyaring bunyi,5
2334,warganet ngamuk sangka korupsi vaksin duluan sehat lanjut sangka positif covid dead tutup selesai ngamuk,17
2335,luhut luhut china china berfikir af pikir positif ayo kerja kerja kerja rakyat,6
2336,menang menang kerja teladan joko widodo presden ri hujan lebat sambut hangat rakyat kerja kerja kerja indonesia cinta ikut protokol sehat disiplin,6
2337,buram seng lawan wassalam,17
2338,gambar gabenar kakak wassalam,17
2339,tahan jilid jilid film rambo biasa pakai kaca mata kuda siantar kakak wassalam,17
2340,parodi ngeri tunggu gusti boten sareh laksana protokol sehat disiplin,21
2341,rabun tokoh percaya joko widodo presiden ri,5
2342,sami mawon perintah dpr jelma mpr dpd pengaruh,17
2343,canda politik dengar belanda silah berpendapat periode periode serah perintah dpr sbg buat uu mekanisme pimpin silah maju batas,17
2344,sedang apa berisik ganjar pilih gubernur hendak rakyat gabenar pilih rakyat takut sara ujar benci fitnah teror tanggung akibat gusti boten sareh,9
2345,tunggu gabenar tata kilah banjir selamet mancing kolam pancing perintah joko widodo atas pandemi covid laksana protokol keshatan disiplin,21
2346,anies ahok salut netizen indonesia kreatif anies omong kosong ahok paten,17
2347,titik koma gubernur ahok wassalam,17
2348,lidah tulang batas termehek mehek ca pek dukung joko widodo presiden ri pandemi covid kerja keras disiplin laksana protokol sehat,21
2349,gubernur ahok in gabenar menang tebar sara ujar benci fitnah teror kasihan banjir rakyat do i dibohongin banjir wassalam,9
2350,gubeburnya ahok gabenar kadrun menang sara ujar benci fitnah teror cain pilih banjir bodoh wassalam,9
2351,atas banjir lanjut gubernur joko widodo ahok akibat gengsi lanjut fokus laksana protokol sehat disiplin,21
2352,sigoblok sigoblok sigoblok banjir jam surut jam surut sami mawon perabot lantai tanam rendam asli tetapi palsu jam surut rusak suda gabenar kadrun aku becus af tata rakyat termehek mehek,17
2353,muji muka badak malu kadrun wassalam,17
2354,partai ngebacot kadrun wassalam,3
2355,ngebacot malu cari benar af korban banjir pilih gabenar tipu sara ujar benci fitnah teror wassalam,9
2356,malu ngebacot dukung gabenar af rakyat pilih korban banjir cari benar malu wassalam,17
2357,poltak lawan karma wassalam,17
2358,menang sara ujar benci fitnah teror hancuuurrrrr cain wassalam,9
2359,salah jalan jalan joko widodo presiden ri periode,5
2360,anjing ku gonggong comberan mampus wassalam,20
2361,anjing stres comberan mampus wassalam,20
2362,anjing tolol comberan stres mampus wassalam,20
2363,anjing stres gonggong comberan mampus wassalam,20
2364,jokowi kerja kerja kerja joko widodo presiden ri istirahat rakyat era reformasi cerdas emas loyang berkat presiden keluarga negara indonesia cinta,6
2365,loh bicara tanggap wakil masyarakat dukung protokol sehat disiplin badai pandemi covid moga cepat,21
2366,pesan patuh hindar pandemi covid rumah paksa haaaaaa layang sakit laksana protokol sehat disiplin paten,21
2367,pecat salah komut bumn rh stres kakak,17
2368,rocky menggrung sakit masuk rs jiwa grogol,15
2369,nginap hotel hati kamar bergoyan ubah akibat salah paham nginap rumah laksana protokol sehat disiplin,21
2370,negarawan sejati tulus uu ite revisi dpr ri perintah polisi aman dan tertib masyarakat selektif terima lapor sengketa joko widodo presiden ri korban rakyat pasal karet,5
2371,tolol safei ngerasanin super star wassalam,7
2372,senang cuma miscall telur beli sukses terusssssssss dagang terima kasih wassalam,3
2373,imlek kasihan singa ampau konglomerat tanoto malu beli rumah jerman harga dukung perintah joko widodo presiden ri kerja keras lawan pandemi covid laksana protokol sehat,21
2374,cak nun ancam turunin presiden andai negara darurat termehek mehek supir presiden taxi turun pinggir jalan ngebacot pakai otak pakai dengkul usaha taxinya bubar,12
2375,uu ite undang lawan politik politik ilmu politik ilmu sosial pandang kenegarawan joko widodo presiden ri korban lawan politik,5
2376,maju luhut binsar pandjaitan pohon kencang angin tiup atas kritik usaha kelola wc negeri lbp senyum senyum ganteng paten,11
2377,marah anak pening sianak rapot unya rapot bawah lemari untung polisi anak babak bur laksana protokol sehat disiplin,21
2378,af lihat maklum take keluarga af sukses terusssssssss terima kasih,3
2379,gembira positif pandemi covid turun positif atas turun waspada disiplin laksana protokol sehat terima kasih kerja keras perintah joko widodo,21
2380,pandemi covid india tangan besi virus coronanya turun drastis indonesia salut perintah joko widodo presiden ri tanam sadar hukum laksana protokol sehat disiplin turun,21
2381,jk kritik panggil polisi beda kritik keras pedas tunggu beda ujar benci fitnah hujat langgar hukum larang urus polisi,18
2382,gembira ria pensiun laksana protokol sehat disiplin pakai masker he he he bilang hati peleset hot jatuh,21
2383,era orde buzzerrp kupluk iqnya jongkok berani saing,17
2384,juang kerja keras jaga setia kawan semangat sama capai laksana protokol sehat disiplin,21
2385,presiden ri joko widodo kritik salah baris sakit hati kadrun colong marah ach kalap jokowi salah hati strokeeeeeee milu,15
2386,pilih presiden anggota dpr dpd dprd gubernur bupati wali kota rakyat pening milu daerah kerja korupsi terima kasih joko widodo presiden ri fraksi dpr dukung tolak,5
2387,burung bersih bersih air alir cegah pandemi covid ayo laksana disiplin protokol sehat,21
2388,anjing gonggong berkat jalan,20
2389,joko widodo presiden ri periode larang kritik keras pedas saran dukung setia hina fitnah dasar hukum lapor wajib demokrasi kebabalasan,5
2390,presiden beda rakyat pilih kepala daerah geser salah komentar rakyat suda zaman atas nama rakyat partai politik gurem partai politik,3
2391,harga lsm abal kelas dunia tokoh dahsyat atas banjir dunia hai hai hai hai hai hai hai ngeri kakak,17
2392,imagine makna lagu ku ku bayang juang kerja keras depan cemerlang semangat sama laksana protokol sehat disiplin,21
2393,jilat sandy anak ingus tolol wassalam,7
2394,sitolol fayruz modal jual akherat susah cain wassalam,17
2395,tolol rakus jabat anggur fairuz wassalam,7
2396,bintang lawan jabat susah lawan gigi dengar bisik jam terbang,17
2397,ayo semangat disiplin laksana protokol sehat dukung gugus tugas covid badai,21
2398,tolol pintar kakak wassalam,7
2399,tolol bilang ganteng rasis comberan gonggong kakak wassalam,7
2400,beken marga sitompul nama batak tembak btl batak afrika pening tante laksana protokol sehat disiplin paten,21
2401,lihat twitter imun tubuh kuat sehat isi twitnya tonton awet muda disiplin laksana protokol sehat,21
2402,nyambung maksud laksana protokol sehat disiplin,21
2403,laku teladan ekor anjing setia indah dlm pandemi covid ajak dukung gugus tugas joko widodo laksana prokes,21
2404,akbar kakak sakit hujan panas gonggong serang x cari beken tolol kakak wassalam,7
2405,kpu rakyat jenuh pilih kepala daerah pileg pilpres sama salah lelah kerja kpu jenuh pilih kepala daerah masuk kerja usul joko widodo presiden fraksi dpr ri paten,6
2406,kerja kerja kerja jalan pintas cari makam keramat cepat kaya kena batu ketemu jaga makam lugu bantu perintah keras atas pandemi covid profesional kes laksana disiplin,6
2407,nasib pensiun sibuk sapu halaman rumah tambah gugus tugas suluh protokol sehat paten,21
2408,pilih kepala daerah serentak gelar tuju fraksi dpr perintah dasar hukum uu laksana revisi fraksi tuju partai politik non parlemen kalah perang,17
2409,pandemi covid laksana protokol sehat wajib disiplin vaksin laksana rakyat indonesia bangga presiden ri joko widodo pionir vaksin sabar tunggu gilir vaksin,21
2410,wanita lemah hormat surga telapak kaki hati sabar hilang patuh protokol sehat laksana disiplin waspada badai covid,21
