,tweets,cluster
2842,waspada virus corona ancam rakyat indonesia cinta mohon dukung gugus tugas covid laku protokol sehat disiplin positif,21
2843,hati canda istri cinta suasana virus corona sensitif focus dukung gugus tugas covid positif turun laksana disiplin protokol sehat atur,21
2844,buru pergi nebeng mobil sport positif dukung terusssss gugus tugas covid protokol sehat disiplin,21
2845,waspada positif turun covid lengah dukung terusssss gugus tugas disiplin laksana protokol sehat,21
2846,sahabat ku coba sukses terusssssssss,3
2847,luhut prabowo sahabat cinta indonesia cinta amat nilai prabowo salip luhut salah kenegarawan joko widodo cerdas peran duet tokoh militer periode perintah,10
2848,apa ahli rendah hati akibat kasihan virus corona vaksin tangkal dukung terusssss gugus tugas covid disiplin laksana protokol sehat positif,21
2849,berani kilah pancasilais ngeri x wajar rakyat indonesia cinta idola tokoh nasionalis kadrun tinggal lapor kembang covid positif,10
2850,ri presiden ri wapres pintar dikit,5
2851,buat salah malu lihat salah malu salah laksana protokol sehat gugus tugas covid positif,21
2852,ikut setia mohon tinggal virus corona positif super rekor rakyat indonesia cinta paham jalan dukung gugus tugas covid disiplin laksana protokol sehat,21
2853,semut seberang laut gajah pelupuk mata fakta negara indonesia cinta mohon aparat polisi tni tindak demo prihatin virus corona gentayang positif rekor,10
2854,hai kampung ku tua gereja pakai kopia jurang gaul malu,17
2855,wanita lawan rasain pria kena batu malu sakit hati wanita fokus dukung gugus tugas covid disiplin laksana protokol sehat positif,21
2856,indah toleransi hormat hormat indonesia cinta laksana pancasila ngebacot fakta kanan garis keras terima kasih positif turun,10
2857,malu pancasila fakta kanan garis keras tni polri bin waspada,0
2858,negara indonesia cinta negara contoh positif disiplin laksana protokol sehat gugus tugas covid,21
2859,bakar bendera pdi juang berita hari rakyat pagi banteng jinak bukti pdi juang partai dewasa patuh perintah hari arah tum megawati soekarnoputri hormat indonesia negara hukum,14
2860,era virus corona sok pintar cuplik patuh gugus tugas covid positif rekor turun mohon laksana protokol sehat disiplin waspada,21
2861,indonesia negara berpendapatan tengah joko widodo presiden ri selamat nilai objektif hak nilai fakta pimpin rakyat indonesia cinta kerja berkat,5
2862,smekdon libur malam do joko widodo presiden ri bantu menteri tni polri bin gugus tugas covid lembaga henti rakyat indonesia cinta lawan virus corona,5
2863,amien rais ngoceh sedang apa tanggap mata perintah baik joko widodo tegur bantu ayo menteri cepat benah tugas ganti rebut menang hati rakyat kerja kerja kerja,6
2864,waspada bahaya positif tinggi mohon panik dukung terusssss gugus tugas covid disiplin laksana protokol sehat,21
2865,polisi selamat ulang rakyat indonesia mohon terusssss jaga aman tertib masyarakat sukses serta bhayangkara sejati damping bhayangkari lemah lembut motivator suami cinta,10
2866,pening tante virus corona positif rakyat indonesia terusssss dukung gugus tugas covid protokol sehat disiplin laksana,21
2867,joko widodo presiden ri tegur bantu keras rakyat indonesia didlm jokowi gazz poll sebab covid mobil presiden cepat menteri benah,5
2868,suasana virus corona ngibuli istri dengar informasi gugus tugas covid patuh terusssss protokol sehat positif waspada,21
2869,berani demo jilid gedung dpr mpr ri demo salah kaprah fakta lengser presiden ri joko widodo bakar bendera pdi juang sibuk cuci tangan tanggung alas susup,5
2870,komentar tolol kakak kader pdi juang mayoritas agama islam laku jual agama,7
2871,maksud sahabat ku dukung terusssss gugus tugas covid laksana disiplin protokol sehat posisif turun mohon waspada,21
2872,sewot tiarap kadrun cain kena batu pdi juang lawan kakak,14
2873,pandai pandai tupai loncat jatuh kalimat kadrun suka demo ganggu kamtipmas kena batu pdi juang kilah tiarap percaya polisi proses tindak pidana bakar bendera,17
2874,pdi juang yes kadrun,14
2875,tunggu borgol ngebacot tolol,7
2876,badai virus corona serah karya dalam negeri dunia internasional remaja batak fokus dukung gugus tugas covid disiplin laksana protokol sehat positif waspada,21
2877,pimpin demo tanggung bakar bendera pdi juang berani demo buat langgar hukum ngelesss susup wajib proses pidana,18
2878,do i disiplin malu langgar atur gugus tugas covid disiplin laksana protokol sehat demo ikut anak positif badai virus corona,21
2879,mohon wajib bakar bendera pdi juang proses hukum kadrun biar langgar hukum aparat tegak hukum ajar timpal indonesia negara hukum kader pdi juang gentar,18
2880,takut waspada lihat adik wanita salut berani mohon patuh arah gugus tugas covid disiplin laksana protokol sehat positif,21
2881,takut waspada lihat adik wanita salut berani mohon patuh arah gugus tugas covid disiplin laksana protokol sehat positif,21
2882,dadak dangdut dadak pancasilais bela ideologi pancasila lupa jejak digital hina pancasila demo kibar bendera hitam merah putih nyata ekstrim kanan,17
2883,kasar yayang batas sabar cain kungfu kakak fokus dukung gugus tugas covid disiplin ikut protokol sehat positif waspada panik,21
2884,pdi juang nasionalis sejati ideologi pancasila kanan kanan kiri kiri hina fitnah malu beridelogi pancasila fakta dukung ormas larang garis keras kanan,17
2885,selamat ulang joko widodo presiden ri rakyat indonesia pimpin jokowi musibah dunia virus corona negara indonesia sulit presiden hati positif turun,5
2886,selamat ulang presiden ri joko widodo pimpin kuat batu karang tengah laut rakyat cinta kerja keras jokowi tengah bencana dunia virus corona layan rakyat maju,5
2887,diam emas pdi juang pohon kencang angin tiup atas pohon diri tegak akar kuat kader rendah hati dukung rakyat maju bakar jenggot fitnah masuk akal sehat,17
2888,lari cepat kuda pacu tinggal virus corona tambah positif panik disiplin patuh protokol sehat gugus tugas covid,21
2889,iq jongkok debat ngebacot ribut kompor kadrun cari panggung kakak beken,17
2890,otak ngeres pikir virus corona lingkung dengar terusssss arah gugus tugas covid rakyat dengar positif laksana protokol sehat disiplin,21
2891,tambah positif waspada lihat do i lepas kangen patuh protokol sehat pakai detik pisah karantina mandiri disiplin dukung gugus tugas covid,21
2892,ngompor i debat lbp rr dua sahabat saudara sibuk cari panggung debat pakai promotor tinju dukung gugus tugas covid disiplin laksana protokol sehat,21
2893,termehek mehek sakit masuk rs jiwa grogol kakak,19
2894,dadak pancasilais dapat ruu haluan ideologi pancasila lupa omong lidah tulang,17
2895,partai politik percaya tolak pt parliamentary threshold alas potensi hilang juta sah kalah perang naik ambang batas dpr mpr ri berkwalitas senayan,17
2896,istirahat lupa berdo a besok masuk new normal disiplin patuh protokol sehat gugus tugas covid,21
2897,masuk new normal tantang hadap mohon dukung terusssssssss gugus tugas covid tambah positif disiplin protokol sehat,21
2898,ruu haluan ideologi pancasila motor pdi juang negara indonesia beridiologi pancasila dukung proses dpr ri fungsi buat uu perintah berat senayan repot,10
2899,dasar lelaki cari sempat dlm sempit contoh fokus dukung gugus tugas covid berdo a positif tambah laksana disiplin protokol sehat,21
2900,gugus tugas covid positif waspada mana virus corona hantu laku baik cegah kreatif disiplin protokol sehat patuh,21
2901,sahabat ku jen pur tni kopassus pramono edhie wibowo tinggal dunia hilang sahabat renda hati do terima sisi maha kuasa keluarga tinggal tabah,3
2902,waspada waspada waspada mohon disiplin laksana arah gugus tugas covid patuh protokol sehat riang gembira lupa berdo a umat setia positif atas,0
2903,disiplin patuh protokol sehat gugus tugas covid positif turun turun malu do i tawa,21
2904,badai virus corona transisi new normal psbb waspada ikut arah gugus tugas covid disiplin laksana protokol sehat,21
2905,ajar ikan renang kakak,17
2906,tambah positif turun moga besok turun new normal normal henti mohon rakyat indonesia cinta disiplin patuh protokol sehat gugus tugas covid,21
2907,tinju hasil ronde sangka tunggu ronde periksa sangka ancam hukum tahan mohon dahulu percaya polisi markas besar polri profesional,18
2908,bicara debat ramai media medsos kompor leduk cari panggung,17
2909,baca lambat mikir telat pikir,17
2910,sabar panik tambah positif patuh arah gugus tugas covid virus corona atas catalan disiplin laksana protokol sehat,21
2911,tambah positif ajak terusssss berdo a moga kerja keras presiden joko widodo tegar gusti boten sare mohon disiplin protokol sehat gugus tugas covid patuh laksana,21
2912,tambah positif mohon masuk normal rakyat indonesia cinta waspada disiplin patuh protokol sehat gugus tugas covid penting,21
2913,kakek opung opa eyang lawan new normal pasang aksi tua keladi tua lho teransisi positif waspada patuh arah gugus tugas covid disiplin laksana protokol sehat,21
2914,rr berani modal ngebacot kakak dukung,17
2915,fakta joko widodo perangkat tahap atas wabah virus corona gugus tugas covid percaya rakyat indonesia cinta mohon baris sakit hati kadrun balik fakta rakyat cerdas,15
2916,positif mohon waspada masuk era normal transisi psbb disiplin ikut protokol gugus tugas covid rumah coba akibat rumah tangga kapal pecah,21
2917,media ukur banding indonesia malaysia ngurusi corona banding indonesia duduk juta malaysia duduk kabupaten kota indonesia indonesia milik kabupaten kota,10
2918,lagu antar tidur nyanyi imut dengar tidur nyenyak berdo a tidur laksana disiplin protokol sehat covid,8
2919,nanyang tinju kelas cari panggung dating kantor lbp terima kasih,3
2920,teladan masuk normal laksana disiplin protokol sehat covid waspada positif capai rakyat indonesia cinta korban rugi,21
2921,jalan lbp saudara xie,17
2922,sayang istri masuk transisi psbb new normal disiplin laksana protokol sehat gugus tugas covid fakta positif tambah atas waspada waspada waspada,0
2923,aneh nyata suka ngebacot nyiyir utang indonesia mengkompori rakyat tantang debat tiarap lbp menko marves mantap maju terusssss rakyat indonesia cinta,10
2924,sabar psbb panjang baik beta rumah cari sibuk positif alih new normal cepat laksana gugus tugas covid disiplin patuh protokol sehat,21
2925,pikir positif mohon bijak apa pikir negatif negatif periksa covid hasil negatif,17
2926,manusia ember kakak xie,17
2927,lelaki cerita syukur wanita takluk suami cinta langgeng dlm rumah tangga dengar informasi gugus tugas covid laksana disiplin protokol sehat,21
2928,sabar sayang berkat do a kerja keras percaya badai virus corona tahap ikut informasi gugus tugas covid laksana protokol sehat berdo a disiplin,21
2929,manusia pecat usaha bumn sbg komisaris refly harun sakit hati rezim jokowi percaya rakyat taudiri salah wakil rakyat berani atas nama rakyat rumah cuci tangan pakai masker,17
2930,moga psbb panjang normal laksana protokol sehat gugus tugas covid disiplin,21
2931,joko widodo presiden ri periode pilih rakyat indonesia cinta dlm milu demokratis maju kerja kerja kerja indonesia dlm suasana musibah dunia covid mudah do a dukung setia tegar,6
2932,pancasila ideologi negara indonesia cinta lahir ingat terima kasih diri republik indonesia karno juang pahlawan antar pintu merdeka indonesia mengkumandangkan proklamasi soekarnohatta,10
2933,kirain dandan buang sampah depan sabar psbb new normal patuh arah gugus tugas covid laksana protokol sehat disiplin,21
2934,rumah pikun akut patuh arah gugus tugas covid laksana protokol sehat disiplin tip virus corona atas berdo a,21
2935,tunggu rakyat indonesia masuk ronde tonton tinju hukum lakon saksi kelas sangka sabar tunggu tahap selidik sidik,18
2936,himbauan mantap ukur suluh keluarga rencana suasana virus corona arah gugus tugas covid patuh laksana tip disiplin protokol sehat,21
2937,percaya virus corona jadi teman waspada panik disiplin ikut arah gugus tugas covid laksana protokol sehat tip joget halaman rumah pergi mall,21
2938,coba provokator moeldoko hukum tegak tiada af tindak mantap,18
2939,uda irwan tolol ngebacot kutil otak cain wassalam,7
2940,jenderal tni kopassus am hendropriyono jabat direktur bin waspada waspada waspada kuliah fh unpad jajah belanda bagi golong masyarakat eropa timur asing bumi putra,0
2941,bicara sekolah sekolah tk toto gelap campur urus ngaca kakak,17
2942,sahabat senang marah mohon benah takut benar,17
2943,nonton kangen poltak raja minyak rm chat kang ujang sunda nuhun,17
2944,peduli khianat lbp pasti tka cina konawe juli mantap lbp rakyat indonesia cinta dukung dengar tk kompor leduk rakyat sejahtera,10
2945,indah kenal dominasi mayoritas tiran minoritas negara indonesia ideologi pancasila dukung gugus tugas covid laksana protokol sehat disiplin patuh psbb tip,21
2946,mohon af lahir bathin selamat raya idul fitri sukses terusssssssss rakyat indonesia cinta virus corona patuh psbb dukung gugus tugas covid laksana disiplin protokol sehat,21
2947,rakyat indonesia cinta renung keluh tugas medis korban keringat air mata nyawa korban penting mohon laku protokol sehat covid,10
2948,besok sahabat ku keluarga istri ku puasa lebaran sabar thr susul selamat bobo doa badai virus corona cepat dukung gugus tugas covid patuh psbb disiplin laku protokol sehat,8
2949,patuh arah gugus tugas covid laksana protokol sehat disiplin hormat tugas lapang lelah mohon guna jalan laksana psbb tip langgar atur tonton malu,21
2950,selamat mei bangkit nasional rakayat indonesia cinta tegar wabah virus corona laksana atur gugus tugas covid disiplin kuat lemah jaga setia kawan,8
2951,rumah stres main terbang an izin terbang patuh protokol sehat gugus tugas covid syarat penuh do badai virus corona cepat,8
2952,kena focus nembaknya gugus tugas covid focus kerja tangan virus corona do protokol sehat patuh laksana disiplin,21
2953,bangga menang sara fitnah ujar benci teror ngaca jakarta beda zaman ahok,9
2954,duduk bonceng stroke ngebacot,23
2955,indonesia arah gugus tugas covid mohon tugas tingkah manusia juang kenal lelah rakyat indonesia cinta hormat,10
2956,dengar do a dukung joko widodo periode presiden ri dukung bantu presiden ri,5
2957,campur rumah tangga tni ikat sumpah sapta marga sumpah prajurit kritik sembunyi belakang demokrasi ilmu dangkal,17
2958,lbp argumentasi china pakai kaca mata kuda wawas luas sempit fakta negara dunia china bsh kadrun dengar lihat rakyat morowali marah dengar banyak bicara,17
2959,damping virus corona khawatir patuh protokol sehat gugus tugas covid waspada panik displin aktif wabah serang indonesia dunia,21
2960,protokol sehat patuh virus corona atas patuh arah gugus tugas covid waspada disiplin ikut percaya lupa berdo a tidur,8
2961,anjingkuuser berani jadi lomok comberan cain,17
2962,selamat malam patuh arah joko widodo presiden ri gugus tugas covid rumah lihat adik patuh nyanyi virus corona atas disiplin selamat bobo berdo a,8
2963,tunggu tahap dahulu wajib profesional mauliate,17
2964,anak buah sby periode presiden ri dukung joko widodo politik lambat jalan nafsu,5
2965,syukur thr terima hak sabar sayang selamat raya lebaran keluarga selamat bobo berdo a dukung perintah swasta cegah virus corona dukung gugus tugas covid,8
2966,nama prabowo salah fatal ngetiknya kena mulut harimau,17
2967,fakta presiden ri kadrun ngebacot terusssssssss fakta kalah melulu,1
2968,amien rais selesai partai diri ajak gabung kader berani sengkuni luar diam duduk bonceng serang perintah joko widodo,23
2969,jari telunjuk dengar modal ngebacot nyinyir dengarin simak laksana arah joko widodo presiden ri gugus tugas covid indonesia cinta tahap bebas virus corona disiplin,21
2970,rumah patuh arah presiden ri joko widodo gugus tugas covid bandel cuci mata luar cain kena batu dikerjain abg pantai rebah rumah janga lupa mandi tidur berdo a,8
2971,sedang apa oposisi gabenar dasar kadrun ngebacot malu malu kadrun,17
2972,lihat karang bunga duka joko widodo keluarga malu ngebacot malu,17
2973,lae duduk bonceng tuju cita percaya mauliate,23
2974,ngototlah mudik hati lho salah tumpang supirnya gila loh patuh arah gugus tugas covid baik selamat bobo lupa berdo a umat,8
2975,percaya hai kawal ajar polisi jemput bola tangan panggil jemput rumah mana bawa markas besar polri dasar hukum bereskain said didu,18
2976,mudik larang coba pakai jalan tikus ngeri kakak nyawa taruh rumah patuh arah perintah pusat provinsi kabupaten kota lurah rw tni polri bin gugus tugas covid,8
2977,termehek mehek tong kosong nyaring bunyi persis kerupuk siram air kadrun kampung sbg kawal periksa rumah indonesia cinta negara hukum jadi hukum panglima bereskain said didu,18
2978,bobo ach besok kerja selesai rumah rumah selingkuh cain tendang selingkuh genit dukung joko widodo cegah tular covid,8
2979,anjing gila comberan mampus cain,20
2980,dukung gabenar marah malu rakyat dukung korban dukung sara fitnah ujar benci teror ditegor menteri akibat rakyat tanggung gagal data terima bantu,9
2981,hibur lagu antar tidur bawa mimpi berdo a tidur moga juang joko widodo covid sukses mohon dukung rakyat indonesia cinta,8
2982,kadrun bela kadrun bela persis pakai kaca mata kuda kadrun bela malu kakak,17
2983,bansos anies pilih serang serang kilah sanggup fakta jelas menko menteri joko widodo ko kadrun pakai kaca mata kuda dukung,17
2984,lbp tokoh panutan lawan kadrun stres sabar duduk bonceng tunggu hasil sabar strokeee,23
2985,inang sayang anak ngelesnya bobo moga mimpi lucu lupa berdo a covid cepat,8
2986,pakai kaca mata kuda kasih komentar kakak xie,17
2987,kakak erti hukum ngebacot hukum dungu pidana sidang lbp acara jaksa tuntut,18
2988,duduk bonceng coba rebut pilpres menang bikin kartu ngebacot nyinyir,23
2989,hati panas kepala dingin rugi istri hilang cerewet istri cinta kalah dlm suasana covid selamat bobo lupa berdo a bantu terusssssssss perintah joko widodo,8
2990,sembuh positif covid komentar keluar bijak lupa joko widodo laku visi misi presiden ri,5
2991,covid hantu mohon focus dengar arah presiden ri joko widodo menteri bingung informasi kepala daerah provinsi bupati walikota camat lurah rw sahabat,8
2992,covid hantu mohon focus dengar arah presiden ri joko widodo menteri bingung informasi kepala daerah provinsi bupati walikota camat lurah rw sahabat,8
2993,jt wakil sekjen tum ahy ketua polhukam tum sby presiden ri ngaca kritik lbp lapor partai lapor ds polisi samak modal ngebacot,17
2994,lagu antar tidur selamat bobo lupa berdo a covid cepat mohon campur tangan edisi sheeran perfect multi language cover in languages travys kim,8
2995,denny siregar maturnuwun cak had wassalam,17
2996,sahabat mudik rencana tunda paksa psbb sanksi laku tanggal mei ancam hukum denda juta patuh kasihan keluarga tempat tuju mudik positif covid,17
2997,bicara dengar baik rakyat indonesia lawan covid selamat bobo lupa berdo a,8
2998,manggilkan polisi selidik indonesia negara hukum,18
2999,indonesia cinta negara hukum hadap hukum ngebacot manusia hadap hukum buang badan terang wajib markas besar polri hina fitnah lbp takut nyali kerupuk alas psbb,18
3000,lbp joko widodo presiden ri hina keji almamater universitas gadjah mada ciduk said didu,5
3001,hobby jelek jelek senang pintar ngebacot anak medan kombur kerja kerja kerja terusssssssss rakyat,6
3002,covid indonesia cinta disiplin tenang sabar syukur dalam pimpin joko widodo presiden ri cermin percaya,5
3003,henti berdo a covid cepat atas cuplik lagu hasil patuh atur psbb selamat bobo mimpi indah,8
3004,presiden ri simbol negara kalah belok capres dukung kalah melulu rubah presiden ri panglima tni polisi bawah presiden ri kakak,1
3005,cari alas sakit panggil moga haru jum at pulang masuk tahan buah simalakama,17
3006,anjing tolol gonggong comberan kakak,20
3007,pintar prof dr dukung capres kalah sok teori presiden ri simbol negara tolol percaya baris sakit hati kadrun kakak,15
3008,lagu hitung lagu sentuh telinga dengar hidup suka ngebacot nyinyir tokoh sukses kalah menang melulu hitung jam jumpa,17
3009,presiden ri simbol negara presiden ri joko widodo repot bantu presiden ri bencana covid presiden ri joko widodo sewot bicara hati bersih syukur,5
3010,hitung tokek malam tokek tokek tidur nyenyak,17
3011,hina ditwitter followersnya dikit kakak,17
3012,presiden ri joko widodo kerja menteri puas fakta tahap hasil rasa rakyat indonesia cinta gelintir kicau nikmat kicau burung pagi istana bogor,5
3013,lagu indah antar bobo malam lupa berdo a nikmat khusuk dukung joko widodo menteri tni polri provinsi kabupaten kota camat lurah rw rakyat indonesia cinta cegah covid,8
3014,seling tidur lihat cuplik sabar mendo badai covid cepat terimakasihku kerja keras perintah joko widodo jajar perintah provinsi kabupaten kota camat lurah tni polri bin,8
3015,marah lihat ahok sukses ahok lawan kakak,17
3016,juru bicara covid henti lawan virus corona selamat bobo lupa berdo a,8
3017,animus injuriandi pasal cemar nama lapor warga negara indonesia negara hukum jadi hukum panglima ciduk said didu,18
3018,mulut harimau tebar fitnah salah kaburdanbuang badan tanggung bangga manusia bukti salah pidana ciduk said didu,17
3019,informasi a surat panggil kirim polisi tidur nyenyak mimpi indah malam bukti ancam hukum tangkap said didu,18
3020,jk hina kader pdi juang ngotot bawa demo markas besar polri tahan af rasain karma sahabat lbp af percik air dulang terpercik muka tangkap said didu,17
3021,samak berita baca judul ngebacot mulut polisi borgol tangkap said didu,17
3022,level coba ngebacoti jabat atas kasihan jokowi lbp sri mulyan et lawan tangkap said didu,17
3023,tong kosong nyaring saidnya tangkap said didu,17
3024,sok kesatria cundang malu tangkap said didu,17
3025,akibat sok sok pintar sok suci ajar hidung hidung salah hidung hadap hukum tangkap said didu,18
3026,dengar ucap hati juang covid air mata keringat darah nyawa korban perang lawan virus corona minta rumah pakai masker mudik,8
3027,perintah joko widodo jajar provinsi kabupaten kota camat lurah tni polri bin badan rakyat indonesia cinta displin lawan covid moga virus corona cepat dengar cuplik,8
3028,selamat bobo sahabat ku budiman mimpi indah berdo a bobo cuplik begiltulah baris sakit hati kadrun kritik fitnah perintah joko widodo jajar kerja keras disiplin melawancovid dihinah,8
3029,followersnya kakak berani ngebacot super tolol kakak,7
3030,marah dukung joko widodo bravo ajak lbp tugas koordinator juru bicara mana berda loyal loyal jokowi lbp,17
3031,marah tolol malao hina balas stresssssssss hati strokeeeeeeeee,7
3032,anjing ku malao kaing kaing comberan mampus,4
3033,kacang lupa kulit jasa dalam mami mama lahir besar tokoh sukses dapat cuplik terusssss berdo a covid cepat selesai,8
3034,pecah dengar percaya baris sakit hati kadrun kakak,15
3035,menang sara fitnah ujar benci teror cain akibat gabenar marah gusti ora sare wassalam,9
3036,malu tuduh non muslim ngatai kafir unya kafir jaga mulut malu tolol pelihara kakak,17
3037,lbp sahabat said didu tapt salah berani aku salah af lbp hati berlian,17
3038,tangkap said didu tangkap said didu tangkap said didu tangkap said didu tangkap said didu tangkap said didu tangkap said didu tangkap said didu tangkap said didu,17
3039,andi fakta non muslim malu bicara kafir diri malu tong kosong nyaring bunyi kakak,17
3040,lapor proses tahap ngebacot sabar duduk bonceng sok djun tolol kakak,23
3041,lbp hati berlian sahabat marah mohon hukum tegak indonesia cinta negara hukum jadi hukum panglima tangkap said didu,18
3042,bangga aku manusia af publik berani mulut fitnah ajar berani tanggung tuduh,17
3043,unya ngebacot fitnahdanmenghina tutup laku korupsi presiden ri gusdur lapor sahabat ray rangkut periksa,17
3044,ahli hukum mulut penuh syarat animus injuriandi cemar nama sebar berita bohong libur penjara nyali megap ancam pidana lupa bawa handuk sabun sikat gigidanodol celana pendek,17
3045,sdr gelisah tidur nyenyak sebar berita bohong dg mulut af sedikit,17
3046,jokowi anjing stressssssss comberan,20
3047,denny siregar keluarga istri ku baran mudik sukabumi patuh arah perintah joko widodo wassalam,3
3048,kena batu rasain wanita lemah coba anggap lemah wanita keras suasan covid selamat tidur lupa berdo a moga badai virus corona cepat berkat,8
3049,wk sekjen tinggal jabat menkopolhukamnya koordinator juru bicara ketua sby presiden ri dpr mpr ri periode benar level kakak didikpambudi tolol,17
3050,gitulah kader partai demokrat dendam prabowo partai gerindra tolak ahy cawapres prabowo nyata menteri tahan joko widodo rakyat bangga prabowo negarawan fokus milu,3
3051,musik antar tidur mimpi indah lupa berdo a moga badai covid cepat mohon dukung arah perintah joko widodo jajar pusat provinsi kabupaten kota camat rw,8
3052,teladan anak bahaya mudik cegah tular covid sorga telapak kaki renung selamat tidur lupa berdo a mimpi indah,8
3053,anjing gila kaing kaing comberan maturnuwun,4
3054,hitung jari kakak modal ngebacot kakak,17
3055,level bawa periode dpr mpr ri unya ngebacot ngaca laku gatot gagal total calon dpr mpr ri kalah mutlak,17
3056,dukung joko widodo kader hikmah lbp dukung jokowi tim sukses bravo fakta menang berkat pihak menang kakak,17
3057,manusia tolol cemburu pakai kasih komentar mampus kakak,7
3058,hibur antar tidur tenang covid panik waspada dengar jelas resmi perintah pusat provinsi kabupaten kota camat lurah rw,8
3059,anjing ku tolol comberan cain,20
3060,anjing kaing kaing comberan kakak tolol,4
3061,tolol harinugros ngebacot kakak,7
3062,malu do i terima kasih,3
3063,gelincir mudik pulang kampung pandai pandai tupai lompat jatuh nasib pandu kenal trans joko widodo beda mudik pulang kampung angka,17
3064,prabowo kader gerindra saksi jokowi juang bangsa rakyat teladan prabowo komandan layak bintang letjen pur tni kopassus jenderal pur tni kopassus presiden ri joko widodo,5
3065,lagu antar tidur mimpi indah covid indonesia negara dunia do dukung kerja keras joko widodo presiden ri jajar rakyat indonesia semangat sama lawan virus corona,8
3066,tidur lihat ditwittku bobonya nyenyak berdo a covid cepat,8
3067,anjing liur liur liur anjing gila x mampus,17
3068,anjing air liur x anjing gila cain,20
