,tweets,cluster
1360,lapor gibran kaesang erti hukum pidana konsekwensinya lapor hukum lapor dukung bukti kuat ancam hukumanya penjara,18
1361,tetangga pakai bikini rumah foto tetangga kasih cerdas kakak iq jongkok wassalam,17
1362,joko widodo presiden ri rakyat indonesia cinta jawa kota sarang rakyat rakyat,5
1363,terima kasih maturnuwun gus yahya cholil staquf ketua pbnu wassalam,3
1364,laku perang termehek mehek perang lawan polda jabar tugas profesional acung jempol nuhun,19
1365,agama salah salah jahat kerja agama jalan hukum indonesia cinta negara at hukum,18
1366,tolol sakit jiwa wassalam,7
1367,dengar banyak bicara bahar termehek mehek tangkap tahan tni polri lho coba malu lembaga tahan aman dan tertib masyarakat indonesia atas langit langit,19
1368,benar lawan munafik opm kadrun tumpas akar akar maju tni polri rakyat indonesia cinta,10
1369,denny siregar denny siregar lawan lawan benar,17
1370,af percaya polisi aman dan tertib masyarakat gentar kadrun kadrun,17
1371,af hukum lihat kasus sama wassalam,18
1372,kerja keras polda jabar selidik sidik bahar s ujar benci dudung jenderal tni ksad acung jempol tunggu hasil hormat polisi profesional laksana tugas,17
1373,lihat kasus campur aduk lho,17
1374,selamat sukses rakyat indonesia cinta mohon af keluarga salah kurang kesal sebal muak laku buruk,10
1375,followersnya dikit lawan juta kakak mantul wassalam,17
1376,mantap lurus video pendek ramai terang benderang ujar benci sebut nama dudung bahar kadrun dudung jenderal tni ksad tugas cipika cipiki prokes,17
1377,film pendek bicara klarifikasi hadap hukum diri duduk rendah,18
1378,biar gambar bicara takut campur tangan,17
1379,hak kritisi dukung terima kasih percaya rakyat indonesia cinta presiden ri,5
1380,marah kakak beda jago wassalam,7
1381,joko widodo presiden ri hormat dukung setia kecewa kapolda jawa barat terang benderang langgar arah joko widodo tangan bahar s kadrun rendah indonesia negara hukum,5
1382,bubar sedang apa ngoceh hati stres wassalam,17
1383,gila harga bangsa hancur kakak silvi,16
1384,hai rh pakai kaca mata kuda keras doktor rabun pecat komut bumn gatot gagal total kakak,17
1385,duduk bonceng gagap lanjut,23
1386,menang bangga menang curang tolol kakak,7
1387,gerak jual agama iq jongkok baca,17
1388,ngajari sikeder ngaca tolol fay rakus jabat,7
1389,mimpi kakak kakak wassalam,12
1390,manusia dungu menghayal pesong kakak,16
1391,manusia usil tong kosong cempreng bunyi urus partai urus negara sukses bawah pimpin joko widodo presiden ri duduk bonceng,23
1392,kadrun sok ngancam polisi bungkus indonesia timur do i layar,17
1393,anjing ku kaing kaing,4
1394,dukung perintah joko widodo presiden ri jajar keras atas pandemi covid ganggu waspada varian omicron tingkat masuk indonesia tingkat protokol sehat,21
1395,ideologi pdi juang pancasila harga mati tawar bubar ideologi pancasila bibir hati tahu,10
1396,selamat natal rakyat indonesia cinta hormat rukun umat agama,10
1397,teladan beda akur sakit malu bsh kadrun provokasi,15
1398,pdi juang partai ku partai ku paten,3
1399,maju giring ketua psi pohon kencang angin tiup atas paten,17
1400,presiden ri joko widodo dengar pidato giring ketua psi bsh kadrun sewot duduk bonceng dengar rakyat tugas presiden cinta rakyat indonesia,5
1401,tedjo tedjo suasana natal izin bohong ngeri suasana apa bohong lho,17
1402,p e b o h o g bohong sempat kerja bohong,6
1403,maklum keder iq jongkok partai karam lanjut,3
1404,terima kasih terima kasih maturnuwun ketua pbnu kh yahya cholil staquf keluarga nu minoritas negara indonesia ideolaginya pancasila lindung berkat,3
1405,selamat natal sukses terusssssssss rexy christian,17
1406,rabun benci malu berkat tokoh tim sukses menang presiden ri paten,5
1407,he ho creeet termehek mehek pesong keder asal bunyi bunyi suda dukung capres wapres rumput goyang,19
1408,kadrun kasih hati jantung mulut biar ngebacot enak udel polri aman dan tertib masyarakat proses hukum,18
1409,tolak pt pt partai kuasa usul pt kakak keder iqnya jongkok kakak lanjut,17
1410,lawan politik baris sakit hati kadrun takut kejar bayang kalah pt hapus galau rakyat indonesia cinta nasionalis pdi juang,15
1411,pakai kaca mata kuda rakyat indonesia cinta takut takut sara ujar benci fitnah teror,9
1412,selamat sukses nu cinta rakyat indonesia maturnuwun,10
1413,malu tolol sok pintar ahy laut kakak,7
1414,mantap badut politik pidato giring jokowi terang benderang menang sara ujar benci fitnah teror paten,9
1415,bocor giring maksud coba alih tokoh aku dunia hebat kakak gagal fokus,17
1416,dasar benci otak ukur baik tolol wassalam,7
1417,bohong pakai isu sara menang pilih kepala daerah giring psi kura perahu pura pilih kepala daerah menang sara ujar benci fitnah teror,9
1418,bukti kakak cari sensasi partai kenal lbp lawan dower,17
1419,berkwalitas unya nyinyir ngebacot makan susah berani nilai sukses kakak,17
1420,lihat isi baliho nyinyir ngebacot kakak wassalam,17
1421,marah baris sakit hati kadrun baliho puan maharani pasang simpatisan sekitar desa dampak erupsi gunung seru lihat maksud baik silah simpatisan tokoh pasang tulis baliho teduh,15
1422,manusia kura dlm perahu bujur,17
1423,maki hina fitnah dialog telat pikir lambat mikir borgol jeblos penjara uber tni singgung marah komandan rendah,17
1424,sekjen pdi juang hasto kristiyanto protes dukung ngotot nyapres kakak ngaca,14
1425,bicara bravo rakus jabat paten,17
1426,san san bego pikir positif benci,17
1427,moga rakyat cinta sekitar desa dampak erupsi gunung seru teduh hati baliho puan maharani ketua dpr ri tokoh pdi juang rakyat indonesia,14
1428,jokowi denny siregar mohon tegar noda rakyat miskin laku koruptor,17
1429,nenek siti fs rendah kerja keras ppkm pimpin joko widodo presiden ri sukses aku dunia internasional suda urus cucu nenek rumah racun pikir rakyat indonesia cinta,5
1430,rocky gerung gerung hati ucap suka hina presiden ri sebut nama joko widodo fakta kaget hasil survei waspada waspada waspada,0
1431,mimpi siang bolong kakak,12
1432,rocky gerung gerung stres dekat pesong nilai pdi juang kompor dungu kakak partai ku laksana uu at hukum,3
1433,kadrun bebas nyinyir ngebacot ajar berani hina jenderal tni dudung percaya jabat ksad,17
1434,maju joko widodo presiden ri lawan politik jokowi stres kerja keras presiden jajar modal nyinyir ngebacot berkat,5
1435,jokowi keren joko widodo presiden ri paten,5
1436,puan maharani ketua dpr ri terang benderang argumentasi sempat maju sabar duduk bonceng ambang batas capres final hapus,23
1437,luhut binsar pandjaitan menko maritim investasi paten,11
1438,fakta jalan jalan laku fitnah gusti boten sare,17
1439,lbp hutang ri nyinyir ngebacot bsh kadrun,17
1440,joko widodo presiden ri jaga sehat rakyat indonesia cinta presiden ri,5
1441,ini salah lihat data jokowi malu kilah kakak wassalam,17
1442,hebat sipoltak tinggal hello kitty sok galak kakak,17
1443,ngotot poltak partai tinggal nyungsep poltak lawan,3
1444,politik partai politik mental tarung kalah perang ngotot kalah melulu kambing hitam urus partai bubar cengeng,1
1445,joko widodo presiden ri salah dahulu dahulu genit an campur bijak jokowi duduk bonceng,23
1446,hening hening selamat natal berkat raya raya,2
1447,sahabat ku kennedy tegak hukum sudut zal cari popularitas murah tangkap do i hero kakak,3
1448,lihat selamat tonton sukses,17
1449,sakit jiwa bahasa medan pesong jenderal kancil dengar printahnya jenderal tni menjungjung sapta marga sumpah prajurit laut zal,17
1450,indonesia cinta ideologi pancasila hormat rukun umat agama kenal dominasi mayoritas tiran minoritas indonesia maju paten,10
1451,indah natal berkat iman sahabat iman jaya indonesia ku cinta,3
1452,tonton baris sakit hati kadrun pakai kaca mata kuda selamat natal berkat paten,15
1453,emang gue pikirin pikirin bicara rakyat indonesia cinta dukung perintah joko widodo presiden ri cegah pandemi covid selamat natal paten,5
1454,tolol simpati kakak wassalam,7
1455,pdi juang ketua megawati soekarnoputri hukum kader pdi juang libat sedih partai politik wakil senayan dpr mpr ri kader libat korupsi,14
1456,sahabat ku denny siregar berani benar do moga berkat paten,3
1457,sahabat ku abu sukses berkat maturnuwun wassalam paten,3
1458,partai apa kader korupsi tunjuk partai politik nol korupsi,3
1459,rakyat indonesia cinta miskin laku koruptor dukung aparat tegak hukum joko widodo presiden ri putus adil kuat hukum hukum mati koruptor,18
1460,berita ichhh ngeri diri bulu kuduk ku sukses densus anti teror paten,3
1461,denny siregar jokowi hapus proses hukum polisi,18
1462,ichhh ngeri lagu takut achhh dengar rakyat,17
1463,anjing stres cebur comberan,20
1464,dunia termehek mehek jabat komisaris utama usaha bumn refly h doktor gagal kerja pecat rengek rengek perhati malu,19
1465,joko widodo presiden ri bsh kadrun stres marah bodoh,5
1466,mauliate terima kasih terima kasih sukses sahabat ku libertus,3
1467,terima kasih berkat sahabat ku sukses,3
1468,bahagia keluarga sarah top student award adik owen medali perak tanding olahraga kuda equestrian moga anak ku berkat amin,3
1469,terima kasih berkat bahagia keluarga ku sarah anak top student award acs jakarta paten,3
1470,sekjen pdi juang hasto kristiyanto kritik salah nyalahkan salah maksud mensos risma semangat baik,14
1471,level adu debat kakak wassalam,17
1472,lucu x termehek mehek mauliate,19
1473,jenderal tni dudung ksad nuhun nyata lindung rakyat indonesia cinta tenang lindung bakar jenggot jalan saudara nkri paten,10
1474,besar besar partai demokrat kaget kaget sedih provinsi riau era ku tonjol kader kepala daerah pimpin dprd tk i tk ii menko polhukam,3
1475,maju sahabat ku deny siregar takut benar paten,3
1476,belanda sakit dagang kaca sepi ngaca berani nyapres pesong kakak,17
1477,partai bangga kader pdi juang paten,14
1478,kompor leduk coba lawan lbp kakak paten,17
1479,kadrun ngancam kadrun x jam ngancam wilayah nkri cinta damai paten,17
1480,kadrun kangen pacar lupa lihat marah lho lho lho sukron,17
1481,cebur pacar pacar focus,17
1482,sby ahy terima kasih bantu obat sby as presiden ri joko widodo mulut keder kumat dasar mulut sekolah lanjut,5
1483,nuhun jenderal tni kang dudung ksad tni rakyat rakyat paten,10
1484,indonesia cinta coba noda budaya indah hormat budaya coba luntur budaya indonesia,10
1485,algojo baliho bilang dudung berkat ksad jenderal bintang bintang lho paten,17
1486,kadrun penjara nyinyir ngebacot malu penjara aniaya anak ngelawan sok jual agama rakyat indonesia cinta takut rakyat jenderal bintang sigit dudung andika,10
1487,kuno kakak tolol erti politik dukung setia joko widodo presiden ri periode paten,5
1488,ich ngeri malu ach untung komen sahabat ku abu penganten janda paten,3
1489,stres lihat indonesia cinta sukses harum dunia internasional terima kasih joko widodo presiden ri maju indonesia maju paten,5
1490,luhut binsar pandjaitan terima kasih indonesia cinta harum dunia internasional maju indonesia maju paten,11
1491,nikmat enak durian black thorn durian musang king kirim om kim pening tanteeeeeee sukses xie,17
1492,sahabat tuan guru bajang tokoh ntb kenegarawanan joko widodo presiden ri moga berkat tokoh paten,5
1493,luhut erick lawan mati kakak,17
1494,megawati soekarnoputri buka ragu duduk badan riset inovasi nasional brin ragu megawati soekarnoputri duduk badan riset inovasi nasional bsh kadrun maju paten,17
1495,waspada waspada waspada baris sakit hati kadrun usaha kacau indonesia cinta dukung tni aman polisi aman dan tertib masyarakat bawa komando joko widodo presiden ri paten merdek,0
1496,megawati soekarnoputri ketua pdi juang presiden ri puan maharani ketua dpr ri arif bijaksan tugas bambang pacul ketua komisi dpr ri paten,14
1497,jenderal tni dudung a r ksad bintang turun panglima tni joko widodo presiden ri berkat maju indonesia maju paten,5
1498,muji idonesia dunia internasional bsh kadrun pesong kakak,17
1499,sangka polisi lapor nulis berita stres pesong lho benci pelihara,17
1500,muntah ketawa pesong sukses terima kasih wassalam,3
1501,ikut setia patuh arah perintah joko widodo presiden ri hubung libur natal laksana protokol sehat disiplin paten,21
1502,zong fadli muak komentar prabowo besar sadar jalan dampak rugi prabowo calon presiden,17
1503,komen salah sok metro tv nasdem nasdem dukung gabenar kakak,17
1504,kumpul anak mencret indonesia halusinasi salah minum obat iq jongkok guru mencret diri murid mencret lari lucu lihat muntah,17
1505,malu in batak aku batak berkat fakta jokowi periode presiden ri sukses paten,5
1506,kaca rumah lbp lawan level,17
1507,mbak puan maharani ketua dpr ri pohon kencang angin tiup atas pohon kokoh kuat akar kader pdi juang rakyat indonesia cinta paten,14
1508,kakak rumah kaca sok ngerasanin lbp level kakak,7
1509,gabenar lag banjir berondok berani nongol diam ribu bahasa percaya kadrun muka badak malu hujan henti banjir nongol malu komentar citra puji sukses,17
1510,sindir mbak puan maharani ketua dpr ri tanam padi baris sakit hati kadrun stres dekat pesong pikir negatif hormat nyata hasto kristiyanto sekjen pdi juang pikir positif paten,14
1511,presiden ri joko widodo maju indonesia cinta paten,5
1512,nieuwe pintar tolol minggir,7
1513,lbp lawan jontor haris rusly tumbuk,17
1514,sitolol sakit jontor presiden supir presiden taxi usaha bangkrut,12
1515,luhut binsar pandjaitan berkat kerja tulus rendah hati percaya presiden ri joko widodo paten,11
1516,luk manusia tolol super tolol,7
1517,org tolol pikir bicara sembarang kakak wassalam,7
1518,nasip menang pilih kepala daerah bersih sara fitnah teror rakyat korban,9
1519,kejam menang gubernur bersih sara fitnah teror rakyat korban rakyat paten,9
1520,sakit malu kejam kejam lapooor trans paten,17
1521,keringat dara air mata nyawa pahlawan korban indonesia jasa rakyat indonesia lupa,10
1522,jenderal tni andika berkat sukses panglima tni lantik hormat presiden ri joko widodo paten,5
1523,puan maharani ketua dpr ri pimpin sidang paripurna putus jenderal tni andika panglima tni tolak intrupsi pks bukti puan pimpin sidang fakta kader pks af paten,17
1524,gabenar nongol banjir bicara sembarang citra dukung bsh kadrun tiarap menang hormat menang sara fitnah teror akibat rakyat korban wassalam,9
1525,kerja ngaca malu bawa batak suku hormat suku sarap sono sioto oto do ho,17
1526,kakak makan isu bohong gaul lbp hati emas berkat,17
1527,luhut binsar pandjaitan menko maritim investasi sbg koordinator ppkm jawa bal tugas joko widodo presiden ri tangan pandemi covid sukses konsisten bsh kadrun pening tante,11
1528,moga luhut binsar pandjaitan berkat hati tokoh selesai penuh abdi sejati rakyat indonesia cinta paten,11
1529,sedang apa ngebacot kader pksnya af sadar salah wassalam,17
1530,tuju supir presiden taxi sayang usaha bangkrut banjir banjir kilah kilah wassalam,12
1531,densus maju rakyat indonesia cinta bangga dilakukuan tari atas gendang sakit belah teroris korban tinggal cacat umur paten,10
1532,terima kasih fakta kau lbp ksp hati luhut binsar pandjaitan emas indonesia cinta joko widodo presiden ri percaya tugas paten,11
1533,bayang hebat lbp abdi indonesia cinta lawan covid sukses laksana tugas presiden ri joko widodo kerja gonggong kutil otak tolol paten,5
1534,negarawan sejati cinta dalam negeri baris sakit hati kadrun muka ditaro malu,15
1535,luhut binsar pandjaitan majikan ksp mulut jaga level lbp paten,11
1536,aku salah fakta lbp erlangga tugas joko widodo presiden ri covid turun derastis level level sebahagian provinsi tofa kadrun sakit emang gue pikirin pikirin paten,5
1537,hebat kadrun percaya karun percaya jujur sukron,17
1538,anjing ku andriana kaing kaing comberan,4
1539,garis menang langgar hukum pimpin legal sara fitnah teror takut kalah kacau kota bakar gabenar hormat,9
1540,cepat jalan sahabat ku lucky kaligis roring lingkung dukung hti fpi bubar,3
1541,terima kasih kunjung negara joko widodo presiden ri rombong abu dhabi uni emirat arab laksana sukses,5
1542,banjir gabenar belah malu kadrun pakai kaca mata kuda babi buta puji mulut,17
1543,agama ajar pimpin legal dukung joko widodo presiden ri luhut binsar pandjaitan menang periode legal menang tim bravo ormas bravo paten,11
1544,bangga joko widodo presiden ri do sehat sukses keluarga berkat amin paten,5
1545,marah san san dungu,17
1546,diagnosis kanker prostat sby telepon presiden jokowi sby memberitahu rencana obat negeri do sby lekas sembuh angkat sakit tubuh amin,17
1547,presiden ri joko widodo kibar merah putih dlm kunjung negara negeri rakyat indonesia cinta bangga jokowi paten,5
1548,marah tolol jf suza,7
1549,beda amat dlm negeri negeri dlm negeri kerja presiden ri jokowi buruk objektif benci x pecat komut bumn darikurang amat negeri objektif beda level,17
1550,olok olok baris sakit hati kadrun modal jual agama benci fakta joko widodo presiden ri kibar indonesia dunia paten,15
1551,moga ngetwitt jalan kakak,17
1552,luhut binsar pandjaitan menko maritim investasi kerja penting rakyat indonesia cinta hubung pandemi covid izin joko widodo presiden ri laksana baik,11
1553,luhut binsar pandjaitan ikut setia berkat baris sakit hati kadrun henti fitnah pohon kencang angin tiup pohon tegak kuat akar abdi tulus,11
1554,tokoh dunia pangeran charles raja inggeris salut joko widodo tokoh dunia rendah hati jujur presiden ri sama percaya presiden ktt g,5
1555,presiden ri presiden ktt g joko widodo glasgow skotlandia berkat,5
1556,sukses joko widodo presiden ri presiden ktt g roma italy negara serta puas pimpin rendah hati maju indonesia cinta,5
1557,baris sakit hati kadrun guncang jiwa sukses jaya joko widodo presiden ri presiden ktt g hati strokeeeeeee kakak,15
1558,bangkit stres terima joko widodo sukses jaya paten,5
1559,nyinyir ngebacot warga negara indonesia moga mema afkan jalan,17
1560,rocky gerung tuding hasto balik data kait beri beasiswa didik kaji banding pimpin sby jokowi hasto bantah rocky gerung dungu ajar sekjen pdi juang hasto,17
1561,presiden ri presiden ktt g joko widodo belakang menko maritim investasi luhut binsar pandjaitan presiden erdogan acara ktt g paten,11
1562,waspada covid beberapa negara dunia china rusia eropa tingkat dukung ppkm disiplin laksana protokol sehat,21
1563,terima kasih presiden ri joko widodo percaya negara gabung ktt g presiden ktt g berkat do a rakyat indonesia cita pimpin jujur rendah hati keras bangun indonesia maju,5
1564,joko widodo presiden ri kumandang kibar indonesia raya bendera merah putih dunia pimpin g paten,5
1565,megawati soekarnoputri ketua pdi juang presiden ri yth disiplin kerja keras ajar alam profesional bidang kader rebut menang hati rakyat indonesia cinta menang dlm milu legislatif pilpres,14
1566,nonton live i news tv jam,17
1567,demo berani ngaca suruh jokowi mundur pakai kaca mata kuda sado siantar malu lihat nilai objektif dunia internasional presiden ri paten,17
1568,demo baris sakit hati kadrun cermin malu joko widodo presiden ri cinta rakyat keras maju indonesia paten,15
1569,megawati soekarnoputri bangsa bangsa lupa jasa pahlawan karno proklamator bangsa indonesia,17
1570,komandan ku koyem lapor terima kasih wassalam,3
1571,ahy keder yh oonnya sekjen pdi juang hasto kristanto tuduh buruk ahy cermin keder suka nyinyir ngebacot kasihan mulut busuk,17
1572,semangat sumpah pemuda dukung perintah joko widodo presiden ri keras rakyat indonesia cinta jaya negeri ku dukung ppkm laksana protokol sehat disiplin,21
1573,hasto kristiyanto sekjen pdi juang cermin ngaca banyak bicara nyinyir jujur rendah hati kader pdi juang partai kader tong kosong cempreng bunyi paten,14
1574,maju joko widodo presiden ri indonesia maju paten,5
1575,biotek farmasi luncur viradef gelar webinar pakar kedokte pandemi covid mohon rakyat indonesia cinta waspada badai virus corona dukung ppkm laksana prokes disiplin,21
1576,bangga indonesia cinta hidup berkat,10
1577,indah berkat umat hati emas sukses paten,3
1578,megawati soekarnoputri tum pdi juang presiden ri tokoh negarawan kontemplasi tunjuk terus joko widodo presiden ri hasto sekjen pdi juang kader dukung setia mohon sabar,14
1579,rakyat indonesia cinta papua seluruh indonesia negeri terima kasih,10
1580,berani nyinyir ngebacot kerja kerja kerja joko widodo presiden ri jajar dukung setia tingkat akar rumput layak neraka jahanam,6
1581,webinar topik damping covid tahan terobos ubah oktober pasti registrasi web seminar biotek farmasi indonesia link,17
1582,ngaca kuliah selesai sok nyinyir ngebacot sono kuliah kasihan ayah laksana protokol sehat disiplin,21
1583,anjing kaing kaing comberan kakak,4
1584,maju hasto sekjen pdi juang indonesia maju rebut menang hati rakyat indonesia cinta kerja kerja kerja megawati soekarnoputri ketua pdi juang presiden ri joko widodo presiden ri paten,14
1585,baris sakit hati kadrun fitnah tolol banget tolol,15
1586,anjing kaing kaing kakak wassalam,4
1587,dungu rocky gerung gerung malu malu lihat survei smrc rakyat indonesia cinta puas kerja presiden ri joko widodo paten,5
1588,kader pdi juang rakyat indonesia cinta dukung setia pdi juang terima kasih bangga puan maharani henti rawat kebhinekaan satu paten,14
1589,lsigitp jenderal polisi kapolri yth manusia lengkap dlm biar nyinyir ngebacot hina joko widodo presiden ri mohon ambil tindak,5
1590,tidak setia darat kena batu cain dukung ppkm joko widodo presiden ri sinar kagum dunia internasional laksana protokol sehat disiplin paten,21
1591,capai piala thomas energi positif presiden ri joko widodo sekjen pdi juang hasto terima kasih paten,14
1592,hasto sekjen pdi juang nyata capai piala thomas akibat energi positif joko widodo presiden ri paten,14
1593,partai dpr kader koruptor tangkap kpk,3
1594,dukung jenderal tni purn moeldoko paten,3
1595,indah negara indonesia cinta pancasila ideologi lestari tahan pdi juang partai politik percaya rakyat indonesia menang dlm milu legislatif pilpres paten,10
1596,coba tipu istri biasa suami pintar istri cinta sukses ppkm perintah joko widodo presiden ri aku dunia laksana protokol sehat disiplin paten,21
1597,ngabalin seberang diakurin luhut binsar pandjaitan dukung joko widodo periode paten,11
1598,selamat sukses berkat lupa dukung ppkm perintah joko widodo presiden ri laksana protokol sehat disiplin paten,21
1599,stres hati pesong ngajari ikan renang ngaca dungu rocky gerung gerung dukung ppkm joko widodo presiden ri laksana protokol sehat disiplin paten,21
1600,babak bur tanding ulang ulang,17
1601,berani debat keteter sikat kakak,17
1602,rocky gerung gerung rumah sertivikat malu atas nama milenial hina joko widodo presiden ri rmg dungu dengar nilai cendikiawan singapore jokowi genius,5
1603,kubu ahy stres pesong balik fakta jam jhonny allen marbun sekjen partai demokrat ketua jenderal tni purn dr moeldoko mohon kubu ahy waspada waspada waspada bohong jelang karam ptun paten,0
1604,kalap hina seberang kubu ahy gugat kader kubu jenderal tni purn dr moeldoko kekanak kana dewasa sabar partai demokrat lanjut paten,3
1605,pikir jujur hati bersih politik megawati soekarnoputri ketua pdi juang presiden ri mahasiswa era tokoh wanita juang rakyat tekan orde,14
1606,baris sakit hati kadrun kompor refly harun komisaris utama bumn gatot gagal total pecat stres megawati soekarnoputri ketua pdi juang presiden ri lantik ketua brin sukses mega,14
1607,alir kecewa serah maha kuasa indah dukung ppkm disiplin laksana protokol sehat paten,21
1608,damping virus corona ungkap cermat level pandemi covid turun angka disiplin laksana protokol sehat dukung ppkm paten,21
1609,selamat sukses megawati soekarnoputri ketua pdi juang presiden ri lantik ketua dewan arah brin presiden ri joko widodo paten,14
1610,gebrak kapolri jend pol lsigitp dalam hati rakyat indonesia cinta aman dan tertib masyarakat maju polisi indonesia maju paten,10
1611,elvis presley lagu kesan lagu ku ikut setia dahsyat selamat hayat hati bersih dukung ppkm laksana protokol sehat disiplin paten,21
1612,anjing ku abbassyaiful kaing kaing comberan cain,4
1613,kuasa hebat kaya raya ge,2
1614,anjing ku yasir harahap kaing kaing comberan,4
1615,duluan bikin ribut rata terima kasih,3
1616,selamat malam seling lepas senja malam dukung ppkm laksana protokol sehat disiplin paten,21
1617,anjing ku sy bwz kaing kaing comberan mampus,4
1618,mantap dukung jenderal tni dr moeldoko lambat sadar lanjut paten,3
1619,you becus lizal lamli pecat kerja nyinyir ngebacot haeya dendam hati stlokeee oei pusing duduk bonceng meldeka,23
1620,manusia muka tembok malu tahun tanah rumah bersertivikat berani ngebacot kakak dungu,17
1621,tolol sy bwz sok bicara politik geli basah mpok atik ngedengarnya,17
1622,anak percaya setia prestasi mantap lbp,17
1623,sore keluarga istri ku cinta latih tik tok rumah tamu paksa numpang gaya tik tok ikan paus numpang paten,17
1624,baris sakit hati kadrun bakar jenggot percaya joko widodo presiden ri luhut binsar pandjaitan menko maritim investasi percaya lbp dasar setia prestasi paten,11
1625,stressssssskan sebentar dekat pesong lbp lho,16
1626,gabenar rahasia menang gabenar sara fitnah ujar benci teror malu bohong janji kampanye rakyat jakarta cinta bohong dasar tk bohong paten,9
1627,stres dekat pesong pikir rumah tanah sertivikat malu malu rocky gerung gerung paten,17
1628,kena batu sakit malu dukung ppkm joko widodo presiden ri laksana protokol sehat disiplin paten,21
1629,maju amang lbp kerja kerja kerja rakyat indonesia cinta mauliate,6
1630,sukses ayah keluarga berkat maturnuwun wassalam,3
1631,letjen tni dudung abdurachman do a rakyat indonesia cinta berkat maha kuasa bintang turun joko widodo presiden ri panglima tni paten,5
1632,mantap letjen dudung sukses do rakyat indonesia cinta bintang cepat turun joko widodo presiden ri paten,5
1633,lizal lamli pesong waras dukung ppkm joko widodo presiden ri aku dunia sukses atas pandemi covid lupa laksana protokol sehat paten,21
1634,terussssssslah buat baik sayang umat dukung ppkm laksana protokol sehat paten,21
1635,issu panama papers diam nama issu baris sakit hati kadrun bakar jenggot goreng diam makan gosip paten,15
1636,densus bubar bocor gede alias pesong dukung ppkm presiden ri joko widodo laksana protokol sehat disiplin paten,21
